{"schema":"bible-strong/avatar-definition","schemaVersion":1,"name":"Miso","body":{"primary":{"type":"sphere","width":244,"height":214,"depth":220,"roundness":1},"nodes":[{"surface":{"type":"cone","width":84,"height":96,"depth":46,"roundness":0,"morphRoundness":0.2,"tipRoundness":0.5,"baseRoundness":0.6},"position":[-72,-96,-12],"rotation":[0,0,-16]},{"surface":{"type":"cone","width":84,"height":96,"depth":46,"roundness":0,"morphRoundness":0.2,"tipRoundness":0.5,"baseRoundness":0.6},"position":[72,-96,-12],"rotation":[0,0,16]}]},"colors":{"body":"#8e7cc3","eyes":"#1b1530"},"expressions":{"neutral":{"head":{"x":0,"y":0,"z":0},"eyes":{"left":{"width":22,"height":46,"x":0,"y":-7,"angle":0},"right":{"width":22,"height":46,"x":0,"y":-7,"angle":0},"spacing":50},"perspective":1,"motion":{"eyes":"none","body":"none"}},"upward-side-glance":{"head":{"x":7.3,"y":27.8,"z":-16.1},"eyes":{"left":{"width":24.501171874999997,"height":38.377734374999996,"x":0,"y":-20.5,"angle":0},"right":{"width":24.501171874999997,"height":38.377734374999996,"x":0,"y":-20.5,"angle":0},"spacing":69.3},"perspective":1,"motion":{"eyes":"none","body":"none"}},"downward-gaze":{"head":{"x":-15.057812500000004,"y":0.14296874999999964,"z":-14.549218750000001},"eyes":{"left":{"width":24.401171875,"height":50.5703125,"x":0,"y":0,"angle":0},"right":{"width":24.401171875,"height":50.5703125,"x":0,"y":0,"angle":0},"spacing":72.7},"perspective":1,"motion":{"eyes":"none","body":"none"}},"skeptical-right":{"head":{"x":-16.528515625,"y":-3.7679687499999996,"z":-13.7296875},"eyes":{"left":{"width":25.090625,"height":53.6796875,"x":0,"y":0,"angle":0},"right":{"width":51.924609375,"height":10,"x":0,"y":0,"angle":0},"spacing":71.3},"perspective":1,"motion":{"eyes":"none","body":"none"}},"small-attentive":{"head":{"x":-4.232421875000001,"y":14.362109375000003,"z":11.204296875},"eyes":{"left":{"width":24.066796874999998,"height":35.59921875,"x":0,"y":0,"angle":0},"right":{"width":24.066796874999998,"height":35.59921875,"x":0,"y":0,"angle":0},"spacing":65.9},"perspective":1,"motion":{"eyes":"none","body":"none"}},"wide-downward-gaze":{"head":{"x":-19.20859375,"y":15.2,"z":11.8},"eyes":{"left":{"width":54.084765625,"height":47.467159708498066,"x":0,"y":0,"angle":0},"right":{"width":55.11410881916995,"height":48.187699944416956,"x":0,"y":0,"angle":0},"spacing":84.5},"perspective":1,"motion":{"eyes":"none","body":"none"}},"surprised-left":{"head":{"x":2.9468749999999986,"y":-16.051171875,"z":-20.916015625},"eyes":{"left":{"width":53.68336723153048,"height":47.74054108796297,"x":0,"y":0,"angle":0},"right":{"width":53.68336723153048,"height":47.74054108796297,"x":0,"y":0,"angle":0},"spacing":85.9},"perspective":1,"motion":{"eyes":"none","body":"none"}},"sleepy-squint":{"head":{"x":3.4,"y":13.22578125,"z":8.976953125},"eyes":{"left":{"width":53.775,"height":10,"x":0,"y":0,"angle":0},"right":{"width":53.775,"height":10,"x":0,"y":0,"angle":0},"spacing":78.872265625},"perspective":1,"motion":{"eyes":"none","body":"none"}},"angry-right":{"head":{"x":8.063671874999999,"y":17.626562500000002,"z":-11.116796874999999},"eyes":{"left":{"width":22.908203124999996,"height":36.40078125,"x":0,"y":0,"angle":-30.865625},"right":{"width":22.908203124999996,"height":36.40078125,"x":0,"y":0,"angle":28.781640625},"spacing":67.059765625},"perspective":1,"motion":{"eyes":"none","body":"none"}},"curious-left":{"head":{"x":-12.303515625,"y":-17.601171875,"z":5.9109375},"eyes":{"left":{"width":22.605859374999994,"height":43.769921874999994,"x":0,"y":0,"angle":23.523046875000002},"right":{"width":22.605859374999994,"height":43.769921874999994,"x":0,"y":0,"angle":-24.042578125000002},"spacing":69.9},"perspective":1,"motion":{"eyes":"none","body":"none"}},"asymmetric-down-right":{"head":{"x":-20.058203125,"y":12.607421875,"z":-12.7},"eyes":{"left":{"width":44.5,"height":37.8,"x":0,"y":0,"angle":0},"right":{"width":24.1,"height":18.2,"x":0,"y":0,"angle":0},"spacing":76.7},"perspective":1,"motion":{"eyes":"none","body":"none"}},"attentive-left":{"head":{"x":1.43359375,"y":6.194140624999999,"z":10.56015625},"eyes":{"left":{"width":25.836718749999996,"height":54.130078125,"x":0,"y":0,"angle":0},"right":{"width":25.836718749999996,"height":54.130078125,"x":0,"y":0,"angle":0},"spacing":71.8},"perspective":1,"motion":{"eyes":"none","body":"none"}},"joyful-wide":{"head":{"x":-2.092968750000001,"y":-15.899609374999999,"z":-14.469921875},"eyes":{"left":{"width":36.20086765973213,"height":81.330859375,"x":0,"y":0,"angle":0},"right":{"width":36.20086765973213,"height":79.17775668160692,"x":0,"y":0,"angle":0},"spacing":74.414453125},"perspective":1,"motion":{"eyes":"none","body":"none"}},"eyes-closed":{"head":{"x":-8.752343750000001,"y":-8.743359375,"z":-10.773828125000001},"eyes":{"left":{"width":58.133984375,"height":11.5,"x":0,"y":0,"angle":0},"right":{"width":58.133984375,"height":11.155468749999997,"x":0,"y":0,"angle":0},"spacing":84.276171875},"perspective":1,"motion":{"eyes":"none","body":"none"}},"joyful-down-right":{"head":{"x":-15.287109375000002,"y":15.006640625,"z":12.787890625},"eyes":{"left":{"width":33.25390625,"height":72.720703125,"x":0,"y":0,"angle":0},"right":{"width":33.25390625,"height":72.720703125,"x":0,"y":0,"angle":0},"spacing":83.7},"perspective":1,"motion":{"eyes":"none","body":"none"}},"skeptical-left":{"head":{"x":3.5292968750000004,"y":-7.0765625,"z":9.830078125},"eyes":{"left":{"width":26.306250000000002,"height":55.281640624999994,"x":0,"y":0,"angle":0},"right":{"width":50.92421875000001,"height":10,"x":0,"y":0,"angle":0},"spacing":77.218359375},"perspective":1,"motion":{"eyes":"none","body":"none"}},"far-right-glance":{"head":{"x":0.31914062500000184,"y":35.307421874999996,"z":-10.904296875},"eyes":{"left":{"width":24.4609375,"height":35.820703125,"x":0,"y":0,"angle":0},"right":{"width":24.4609375,"height":35.820703125,"x":0,"y":0,"angle":0},"spacing":68.9},"perspective":1,"motion":{"eyes":"none","body":"none"}},"angry-left":{"head":{"x":-14.750781250000001,"y":-19.350000000000005,"z":5.631640624999998},"eyes":{"left":{"width":21.602343750000003,"height":44.63984375,"x":0,"y":0,"angle":-27.606640625},"right":{"width":21.602343750000003,"height":44.63984375,"x":0,"y":0,"angle":26.1484375},"spacing":70.1},"perspective":1,"motion":{"eyes":"none","body":"none"}},"playful-right":{"head":{"x":-4.3953125,"y":14.07265625,"z":-16.126171874999997},"eyes":{"left":{"width":21.045145681988206,"height":39.370703125,"x":0,"y":0,"angle":26.2921875},"right":{"width":21.045145681988206,"height":39.370703125,"x":0,"y":0,"angle":-20.249218750000004},"spacing":66.73124999999999},"perspective":1,"motion":{"eyes":"none","body":"none"}},"asymmetric-up-left":{"head":{"x":6.585546875,"y":4.737109375000001,"z":12.840234374999998},"eyes":{"left":{"width":44.1,"height":37.7,"x":0,"y":0,"angle":0},"right":{"width":24.2,"height":18.1,"x":0,"y":0,"angle":0},"spacing":75.4},"perspective":1,"motion":{"eyes":"none","body":"none"}},"gentle-downward-gaze":{"head":{"x":-6.077734375000001,"y":-11.03515625,"z":-13.965625000000001},"eyes":{"left":{"width":25.045703125,"height":54.68515625,"x":0,"y":0,"angle":0},"right":{"width":25.045703125,"height":54.68515625,"x":0,"y":0,"angle":0},"spacing":71.2},"perspective":1,"motion":{"eyes":"none","body":"none"}},"wide-down-left":{"head":{"x":-17.127734375000003,"y":18.070703124999998,"z":13.891796875},"eyes":{"left":{"width":37.452734375,"height":75.104296875,"x":0,"y":0,"angle":0},"right":{"width":37.452734375,"height":75.104296875,"x":0,"y":0,"angle":0},"spacing":85.8},"perspective":1,"motion":{"eyes":"none","body":"none"}},"surprised-wide-left":{"head":{"x":-5.428125,"y":-11.71328125,"z":-13.472265625000002},"eyes":{"left":{"width":53.4,"height":46.1,"x":0,"y":0,"angle":0},"right":{"width":52.5,"height":45.4,"x":0,"y":0,"angle":0},"spacing":84},"perspective":1,"motion":{"eyes":"none","body":"none"}},"drowsy-closed":{"head":{"x":10.292578125,"y":3.39921875,"z":7.583203125},"eyes":{"left":{"width":57.672265625,"height":10.616015625000003,"x":0,"y":0,"angle":0},"right":{"width":57.672265625,"height":10.616015625000003,"x":0,"y":0,"angle":0},"spacing":83.416796875},"perspective":1,"motion":{"eyes":"none","body":"none"}},"suspicious-right":{"head":{"x":-17.8,"y":10,"z":-10.894921875},"eyes":{"left":{"width":25.969921875,"height":51.89296875,"x":0,"y":-9.8,"angle":0},"right":{"width":55.56328125,"height":10,"x":0,"y":-9.8,"angle":0},"spacing":74.94375},"perspective":1,"motion":{"eyes":"none","body":"none"}},"shy-downward":{"head":{"x":7.131640624999998,"y":7.7828124999999995,"z":3.935546874999999},"eyes":{"left":{"width":23.5,"height":28,"x":0,"y":40,"angle":0},"right":{"width":25.2,"height":29.5,"x":0,"y":40,"angle":0},"spacing":66.2},"perspective":1,"motion":{"eyes":"none","body":"none"}},"angry-brows":{"head":{"x":10.473974503042374,"y":5.087293619785961,"z":4.698252132317348},"eyes":{"left":{"width":29.126562499999995,"height":59.028125,"x":0,"y":0,"angle":-36.244531249999994},"right":{"width":29.126562499999995,"height":59.028125,"x":0,"y":0,"angle":27.730078125000002},"spacing":83.7},"perspective":1,"motion":{"eyes":"none","body":"shake"},"colors":{"body":"#ba3636","eyes":"#610000"}},"uneasy-left":{"head":{"x":-12.303515625,"y":-17.601171875,"z":5.9109375},"eyes":{"left":{"width":22.605859374999994,"height":43.769921874999994,"x":0,"y":0,"angle":23.523046875000002},"right":{"width":22.605859374999994,"height":43.769921874999994,"x":0,"y":0,"angle":-24.042578125000002},"spacing":69.9},"perspective":1,"motion":{"eyes":"shake","body":"slowDrift"},"colors":{"body":"#adc3ff"}},"front":{"head":{"x":0,"y":0,"z":0},"eyes":{"left":{"width":22,"height":46,"x":0,"y":-7,"angle":0},"right":{"width":22,"height":46,"x":0,"y":-7,"angle":0},"spacing":50},"perspective":1,"motion":{"eyes":"none","body":"none"}},"look-left":{"head":{"x":2,"y":-30,"z":0},"eyes":{"left":{"width":23,"height":46,"x":0,"y":-7,"angle":0},"right":{"width":23,"height":46,"x":0,"y":-7,"angle":0},"spacing":50},"perspect